{
  "schemaVersion": 1,
  "jobType": "BUILD",
  "subjectId": "fe3b9a09-e696-4104-beb7-d8fd1fb85d24",
  "createdAt": "2026-07-22T10:05:00Z",
  "payload": {
    "requirementFileId": "2b0e75d6-c238-4f39-9bf9-5e246eb7c4cd",
    "solveMode": "COMPATIBLE",
    "targetSnapshot": {
      "os": "LINUX",
      "architecture": "AARCH64",
      "pythonImplementation": "CPYTHON",
      "pythonVersion": "3.11",
      "pythonFullVersion": "3.11.9",
      "platformTag": "manylinux2014_aarch64",
      "abiTags": ["cp311", "abi3", "none"],
      "validationType": "STATIC",
      "validationPolicyVersion": "v1"
    }
  }
}
