{"schemaVersion":1,"jobType":"BUILD","subjectId":"fe3b9a09-e696-4104-beb7-d8fd1fb85d24","createdAt":"2026-07-22T10:05:00Z","payload":{"requirementFileId":"2b0e75d6-c238-4f39-9bf9-5e246eb7c4cd","normalizedObjectKey":"normalized.txt","solveMode":"COMPATIBLE","targetSnapshot":{"profileId":"d29ec24f-095c-45f6-ac96-acdef0e7d8ad","profileCode":"cp311","os":"LINUX","architecture":"AARCH64","pythonImplementation":"CPYTHON","pythonVersion":"3.11","pythonFullVersion":"3.11.9","platformTag":"manylinux2014_aarch64","abiTags":["cp311"],"validationType":"STATIC","validationPolicyVersion":"v1","profileVersion":1.0}}}
